{
 "schema": "vsetin-osint/parovani-smluv@1",
 "zdroj": "Hlídač státu – hledání smluv (registr smluv)",
 "stav_k": "2026-10-23 02:20 SELČ",
 "metoda": "dotaz ico:00304450 + klíčová slova akce; ručně vybrány relevantní smlouvy",
 "upozorneni": "Fulltextové párování – relevance ověřena jen podle názvu dodavatele/částky.",
 "akce": [
  {
   "akce": "Oprava lávky Vs-01-Bel v Lázkách",
   "org": "00009989",
   "dotaz": "ico:00304450 lávk* Lázk*",
   "nalezeno": 11,
   "klicove": [
    {
     "id": "37251477",
     "podpis": "2026-03-12",
     "dodavatel": "Damostis s.r.o.",
     "Kc": 532279,
     "pozn": "PŘESNĚ odpovídá nabídce diagnostiky z RO 2/2026 (532 279 Kč s DPH)",
     "url": "https://www.hlidacstatu.cz/Detail/37251477"
    },
    {
     "id": "38819378",
     "podpis": "2026-07-16",
     "dodavatel": "Ing. Miroslav Macek",
     "Kc": 217800,
     "url": "https://www.hlidacstatu.cz/Detail/38819378"
    },
    {
     "id": "39548425",
     "podpis": "2026-09-15",
     "dodavatel": "Damostis s.r.o.",
     "Kc": 119790,
     "url": "https://www.hlidacstatu.cz/Detail/39548425"
    },
    {
     "id": "39554985",
     "podpis": "2026-09-15",
     "dodavatel": "Ing. Miroslav Macek",
     "Kc": 78650,
     "url": "https://www.hlidacstatu.cz/Detail/39554985"
    }
   ],
   "chybi": "smlouva na stavební práce (RO 12/2026: 12,8 mil. Kč) – k 23.10.2026 2:20 SELČ v registru stále nenalezena (dotazy 'Vs-01-Bel', 'lávk* v Lázkách')"
  },
  {
   "akce": "Rekonstrukce hřbitova – rozšíření kolumbária",
   "org": "00009929",
   "dotaz": "ico:00304450 kolumbári*",
   "nalezeno": 5,
   "klicove": [
    {
     "id": "39450769",
     "podpis": "2026-09-07",
     "dodavatel": "Martin Urban",
     "Kc": 46920679,
     "pozn": "Max. hodnota smlouvy 46,9 mil. Kč vs. rozpočet 2026 po RO 12: 26,2 mil. Kč (1. etapa) – ověřit vícelet. financování/etapy",
     "url": "https://www.hlidacstatu.cz/Detail/39450769",
     "cislo": "0519 2026",
     "bez_DPH": 38777420,
     "s_DPH": 46920679,
     "ico_dodavatele": "73257958",
     "sidlo": "Lhota u Vsetína 10",
     "schvalil": "Čunek Jiří",
     "nazev": "Smlouva o dílo – Rozšíření hřbitova ve Vsetíně – kolumbárium"
    },
    {
     "id": "31260860",
     "podpis": "2024-12-04",
     "dodavatel": "Ing. PETR BRAVENEC projektová kancelář s.r.o.",
     "Kc": 1936000,
     "pozn": "projektová dokumentace",
     "url": "https://www.hlidacstatu.cz/Detail/31260860"
    },
    {
     "id": "39512277",
     "podpis": "2026-09-09",
     "dodavatel": "Ing. PETR BRAVENEC projektová kancelář s.r.o.",
     "Kc": 229900,
     "url": "https://www.hlidacstatu.cz/Detail/39512277"
    }
   ]
  },
  {
   "akce": "Městské lázně – vzduchotechnika",
   "org": "00009956",
   "dotaz": "ico:00304450 \"městské lázně\" vzduchotechnik*",
   "nalezeno": 10,
   "klicove": [
    {
     "id": "38370901",
     "podpis": "2026-06-15",
     "dodavatel": "JASY Vsetín s.r.o.",
     "Kc": 11355309,
     "pozn": "odpovídá RO 11/2026 (+11,5 mil. → 11,85 mil.)",
     "url": "https://www.hlidacstatu.cz/Detail/38370901"
    },
    {
     "id": "39763845",
     "podpis": "2026-10-01",
     "dodavatel": "JASY Vsetín s.r.o.",
     "Kc": 503274,
     "url": "https://www.hlidacstatu.cz/Detail/39763845"
    },
    {
     "id": "25054015",
     "podpis": "2023-07-07",
     "dodavatel": "TESP Contract s.r.o.",
     "Kc": 7779173,
     "pozn": "Městské lázně 2023",
     "url": "https://www.hlidacstatu.cz/Detail/25054015"
    }
   ]
  },
  {
   "akce": "Fotovoltaická elektrárna na budově ZŠ Ohrada",
   "org": "00009899",
   "dotaz": "ico:00304450 fotovoltaick* \"ZŠ Ohrada\"",
   "nalezeno": 10,
   "klicove": [
    {
     "id": "39793809",
     "podpis": "2026-10-02",
     "dodavatel": "H & B delta, s.r.o.",
     "Kc": 2257416,
     "url": "https://www.hlidacstatu.cz/Detail/39793809"
    },
    {
     "id": "38646664",
     "podpis": "2026-07-03",
     "dodavatel": "H & B delta, s.r.o.",
     "Kc": null,
     "pozn": "hodnota neuvedena",
     "url": "https://www.hlidacstatu.cz/Detail/38646664"
    },
    {
     "id": "32832428",
     "podpis": "2025-04-08",
     "dodavatel": "Zero Emission Consulting, s.r.o.",
     "Kc": 333960,
     "url": "https://www.hlidacstatu.cz/Detail/32832428"
    },
    {
     "id": "26733911",
     "podpis": "2023-12-04",
     "dodavatel": "Zero Emission Consulting, s.r.o.",
     "Kc": 822800,
     "url": "https://www.hlidacstatu.cz/Detail/26733911"
    },
    {
     "id": "36270289",
     "podpis": "2025-12-15",
     "dodavatel": "Státní fond životního prostředí ČR",
     "Kc": null,
     "pozn": "dotace",
     "url": "https://www.hlidacstatu.cz/Detail/36270289"
    }
   ],
   "chybi": "hlavní smlouva na stavbu (rozpočet 36,3 mil. Kč po RO 12/2026) – k ověření, zda je některá z H & B delta"
  },
  {
   "akce": "Zanádražní prostor",
   "org": "00009844",
   "dotaz": "ico:00304450 \"zanádražní prostor\"",
   "nalezeno": 32,
   "klicove": [
    {
     "id": "31486764",
     "podpis": "2024-12-17",
     "dodavatel": "PORR a.s.",
     "Kc": 5349227,
     "pozn": "dodatek/ část – hlavní smlouvu dohledat",
     "url": "https://www.hlidacstatu.cz/Detail/31486764"
    }
   ]
  },
  {
   "akce": "Sportovní areál Ohrada",
   "org": "00009770",
   "dotaz": "ico:00304450 \"sportovní areál\" Ohrada",
   "nalezeno": 19,
   "klicove": [
    {
     "id": "16012899",
     "podpis": "2021-03-25",
     "dodavatel": "CHVÁLEK ATELIÉR s.r.o.",
     "Kc": null,
     "url": "https://www.hlidacstatu.cz/Detail/16012899"
    },
    {
     "id": "20262115",
     "podpis": "2022-05-06",
     "dodavatel": "CHVÁLEK ATELIÉR s.r.o.",
     "Kc": 82280,
     "url": "https://www.hlidacstatu.cz/Detail/20262115"
    },
    {
     "id": "17888751",
     "podpis": "2021-09-29",
     "dodavatel": "FC Vsetín, z.s. (IČO 62334697)",
     "Kc": 36300000,
     "bez_DPH": 30000000,
     "cislo": "565/1S/2021",
     "nazev": "Smlouva o smlouvě budoucí o nájmu a provozu sportovního areálu",
     "schvalil": "Mgr. Simona Hlaváčová",
     "pozn": "přílohy odkazují na program 'Regionální … 2024' – pravděpodobně dotační program pro sportovní infrastrukturu; ověřit",
     "url": "https://www.hlidacstatu.cz/Detail/17888751"
    },
    {
     "id": "17860275",
     "podpis": "2021-09-24",
     "dodavatel": "PB SCOM s.r.o.",
     "Kc": 5906453,
     "url": "https://www.hlidacstatu.cz/Detail/17860275"
    },
    {
     "id": "19666119",
     "podpis": "2022-03-14",
     "dodavatel": "CHVÁLEK ATELIÉR s.r.o.",
     "Kc": 453750,
     "url": "https://www.hlidacstatu.cz/Detail/19666119"
    },
    {
     "id": "12231152",
     "podpis": "2020-04-07",
     "dodavatel": "CHVÁLEK ATELIÉR s.r.o.",
     "Kc": 329556,
     "url": "https://www.hlidacstatu.cz/Detail/12231152"
    }
   ],
   "chybi": "smlouva na I. etapu (rozpočet 52 mil. Kč po RO 12/2026)"
  }
 ],
 "vazby_k_overeni": [
  {
   "typ": "darce→dodavatel",
   "nazev": "H & B delta, s.r.o.",
   "ico": "25835661",
   "popis": "Dar MVK (RO 21/2025) a v r. 2026 dodavatel u FVE ZŠ Ohrada (smlouvy 38646664, 39793809). Stejný vzorec jako LPT System."
  }
 ],
 "dalsi_smlouvy_subjektu": [
  {
   "subjekt": "Agentura pro ekonomický rozvoj Vsetínska, o.p.s.",
   "ico": "26863081",
   "sidlo": "Horní náměstí 3, Vsetín",
   "skutecny_majitel": "v evidenci nezjištěn (dle Hlídače státu)",
   "smlouvy": [
    {
     "id": "24977135",
     "podpis": "2023-06-28",
     "nazev": "Dodatek č. 2 – Zhodnocení předmětu nájmu – rekonstrukce (k nájemní smlouvě 4836/1S/2012)",
     "bez_DPH": 18328000,
     "s_DPH": 22176880,
     "schvalil": "Čunek Jiří"
    },
    {
     "id": "900889",
     "podpis": "2016-12-20",
     "Kc": 2591000
    },
    {
     "id": "26971347",
     "podpis": "2023-12-19",
     "Kc": 50457
    },
    {
     "id": "28019327",
     "podpis": "2024-03-18",
     "Kc": null
    }
   ],
   "vazba_RO": "RO 8/2023 'Dohoda o narovnání AERV' 3 848 880 Kč; RO 21/2023 'Peněžitý vklad – AERV' 3 600 000 Kč"
  },
  {
   "subjekt": "DN Vsetín s.r.o.",
   "ico": "19690711",
   "sidlo": "Smetanova 1484, Vsetín (budova čp. 1484 je v majetku/správě města – viz RO 'Pasportizace budovy čp. 1484')",
   "skutecny_majitel": "v evidenci nezjištěn (dle Hlídače státu)",
   "smlouvy": [
    {
     "id": "25785927",
     "podpis": "2023-09-15",
     "nazev": "Smlouva o zápůjčce",
     "Kc": 1000000
    },
    {
     "id": "25946091",
     "podpis": "2023-09-29",
     "nazev": "Nájemní smlouva na pronájem pozemku vč. příslušenství",
     "bez_DPH": 18000000,
     "s_DPH": 21780000,
     "cislo": "565/1S/2023",
     "schvalil": "Čunek Jiří",
     "pozn": "v registru město jako plátce – ověřit směr plateb v PDF"
    },
    {
     "id": "25907979",
     "podpis": "2023-09-27",
     "Kc": 239290
    },
    {
     "id": "25937475",
     "podpis": "2023-09-27",
     "Kc": 84372
    },
    {
     "id": "25914355",
     "podpis": "2023-09-27",
     "platce": "Zlínský kraj",
     "Kc": 2631381
    },
    {
     "id": "25984191",
     "podpis": "2023-09-29",
     "nazev": "DN Vsetín → Z-Group bus a.s.",
     "Kc": 214775
    },
    {
     "id": "25984079",
     "podpis": "2023-10-05",
     "nazev": "DN Vsetín → Igor Hendrych",
     "Kc": 1118040
    }
   ],
   "vazba_RO": "RO 13/2023 zápůjčka 1 000 000 Kč + vklad 1 000 Kč (ORJ 0001, ODPA 2292 = dopravní obslužnost)",
   "hypoteza": "ODPA 2292 a smlouvy se Zlínským krajem a Z-Group bus naznačují dopravní (MHD/linkovou) společnost – ověřit v obchodním rejstříku."
  }
 ]
}